{
  "$schema": "https://json-schema.org/draft/2020-12/schema",
  "$id": "https://human-talent.example/schemas/domain-event/0.2.1",
  "title": "Domain Event",
  "description": "Tenant-scoped append-only event envelope for auditable state changes.",
  "type": "object",
  "additionalProperties": false,
  "required": [
    "schema_version",
    "event_id",
    "tenant_id",
    "event_type",
    "aggregate_type",
    "aggregate_id",
    "aggregate_version",
    "occurred_at",
    "actor",
    "payload"
  ],
  "properties": {
    "schema_version": { "const": "0.2.1" },
    "event_id": { "type": "string" },
    "tenant_id": { "type": "string" },
    "event_type": { "type": "string", "pattern": "^[A-Z][A-Za-z0-9]+$" },
    "aggregate_type": { "type": "string" },
    "aggregate_id": { "type": "string" },
    "aggregate_version": { "type": "integer", "minimum": 1 },
    "occurred_at": { "type": "string", "format": "date-time" },
    "recorded_at": { "type": ["string", "null"], "format": "date-time" },
    "actor": {
      "type": "object",
      "additionalProperties": false,
      "required": ["type", "id"],
      "properties": {
        "type": { "enum": ["human", "service", "system"] },
        "id": { "type": "string" }
      }
    },
    "correlation_id": { "type": ["string", "null"] },
    "causation_id": { "type": ["string", "null"] },
    "idempotency_key": { "type": ["string", "null"] },
    "policy_version": { "type": ["string", "null"] },
    "payload": { "type": "object" }
  }
}

